Coin,Description,Rank,Market capitalization,Market capitalization - Currency,Social dominance %,Category
BTC,Bitcoin,1,2276597743905.54,USD,20.604283128326482,"Cryptocurrencies, Layer 1"
ETH,Ethereum,2,429309771081.4726,USD,13.455135814358291,"Smart contract platforms, Layer 1, World Liberty Financial portfolio"
XRP,XRP,3,177029601147.5325,USD,4.214120367390135,"Cryptocurrencies, Enterprise solutions, Layer 1, Made in America"
USDT,Tether USDt,4,163905845497.8526,USD,0.9738361987944206,"Stablecoins, Asset-backed stablecoins, Fiat-backed stablecoins, World Liberty Financial portfolio"
BNB,BNB,5,105459325427.1414,USD,1.34720015655537,"Smart contract platforms, Centralized exchange, Layer 1, Exchange tokens"
SOL,Solana,6,87949659474.60086,USD,10.521396329703549,"Smart contract platforms, Layer 1, Made in America"
USDC,USDC,7,64171235698.43144,USD,2.0334173616815283,"Stablecoins, Asset-backed stablecoins, Made in America, Fiat-backed stablecoins, World Liberty Financial portfolio"
TRX,TRON,8,31269125323.072445,USD,0.5502612260242403,"Smart contract platforms, Payments, Layer 1, World Liberty Financial portfolio"
DOGE,Dogecoin,9,30272554190.003704,USD,2.8322874850976283,"Memes, Cryptocurrencies, Layer 1, Made in America"
ADA,Cardano,10,26221914053.837242,USD,2.448237593373176,"Smart contract platforms, Layer 1, Made in America"
XLM,Stellar,11,12747055745.99814,USD,0.5090624444782046,"Cryptocurrencies, Smart contract platforms, Layer 1, Made in America, Real-world assets, Exchange tokens"
HYPE,Hyperliquid,12,12630833408.5,USD,0.8409701283084553,"Decentralized exchange, Derivatives, Layer 1, Exchange tokens"
SUI,Sui,13,12108062028.213486,USD,1.5127677598935012,"Smart contract platforms, Developments tools, Scaling, Layer 1, Made in America, World Liberty Financial portfolio"
LINK,Chainlink,14,11288330208.127539,USD,1.4189117856839384,"Oracles, Data management and AI, Interoperability, Web3, Made in America, Real-world assets, World Liberty Financial portfolio"
BCH,Bitcoin Cash,15,11063941319.3125,USD,0.27693305970475923,"Cryptocurrencies, Layer 1, Made in America"
HBAR,Hedera,16,10439620370.999989,USD,0.8279667628829878,"Smart contract platforms, Enterprise solutions, DeFi, Layer 1, Made in America, Real-world assets"
USDE,Ethena USDe,17,9417607169.57891,USD,0.05059725358622519,"Stablecoins, Asset-backed stablecoins"
AVAX,Avalanche,18,9230515465.507568,USD,0.983878401796267,"Smart contract platforms, Layer 1, Made in America, Real-world assets, World Liberty Financial portfolio"
LTC,Litecoin,19,8862172844.086395,USD,1.0876478328153445,"Cryptocurrencies, Layer 1, Made in America"
TON,Toncoin,20,8278769832.354469,USD,0.5518061803322167,"Smart contract platforms, Layer 1"
LEO,UNUS SED LEO,21,8287533493.95215,USD,0.007467279155218985,"Centralized exchange, Payments, Exchange tokens"
SHIB,Shiba Inu,22,7226515565.4575815,USD,1.3236396033587308,"Memes, Cryptocurrencies"
UNI,Uniswap,23,5877271371.614067,USD,0.5157572464794354,"Decentralized exchange, DeFi, DAO, Made in America, Exchange tokens"
DOT,Polkadot,24,5818439084.736619,USD,0.4575639675456598,"Smart contract platforms, Layer 1"
XMR,Monero,25,5661490223.662199,USD,0.2372792324666998,"Privacy, Cryptocurrencies, Layer 1"
DAI,Dai,26,5363826741.681099,USD,0.07454404535985848,"Stablecoins, Asset-backed stablecoins, DeFi"
BGB,Bitget Token,27,4927957573.129117,USD,0.007081040578224899,"Centralized exchange, Exchange tokens"
PEPE,Pepe,28,4381905994.791309,USD,2.1630647773592098,Memes
CRO,Cronos,29,4365590341.312794,USD,0.5541236117941812,"Smart contract platforms, Centralized exchange, Payments, Layer 1, Exchange tokens"
AAVE,Aave,30,3998774930.289652,USD,0.18204711595654557,"Lending and borrowing, DeFi, DAO, Made in America, World Liberty Financial portfolio"
ENA,Ethena,31,3933678656.25,USD,0.941907143096243,"DeFi, World Liberty Financial portfolio"
TAO,Bittensor,32,3403381531.68,USD,0.972934975448101,"Distributed computing and storage, Oracles, Data management and AI, DAO, Layer 1, DePIN"
ETC,Ethereum Classic,33,3087566309.290946,USD,0.13170735475498313,"Smart contract platforms, Layer 1"
NEAR,NEAR Protocol,34,3075389457.1925,USD,0.3956370490342748,"Smart contract platforms, Data management and AI, Interoperability, Layer 1, Made in America"
ONDO,Ondo,35,2918415126.36549,USD,0.3564982065655408,"Made in America, Real-world assets, World Liberty Financial portfolio"
APT,Aptos,36,2860979365.9800878,USD,0.29508627282348127,"Smart contract platforms, Layer 1, Made in America"
OKB,OKB,37,2781480000,USD,0.10261071528809536,"Centralized exchange, Layer 1, Exchange tokens"
ICP,Internet Computer,38,2762901958.869797,USD,0.5779416573754831,"Smart contract platforms, Data management and AI, DeFi, Layer 1, DePIN"
PI,PI,39,2751800719.455564,USD,,Layer 1
MNT,Mantle,40,2483720648.92679,USD,0.18075965403323196,"Scaling, DeFi, DAO"
KAS,Kaspa,41,2300479418.316602,USD,1.1469998274801023,"Cryptocurrencies, Layer 1, Made in America"
PENGU,Pudgy Penguins,42,2216080403.7582703,USD,1.1473860660570963,"Memes, NFTs and collectibles, Made in America"
USD1,World Liberty Financial USD,43,2166244627.3176947,USD,,"Stablecoins, Made in America, World Liberty Financial portfolio"
BONK,Bonk,44,2159292006.574287,USD,1.4517420647284356,"Memes, Made in America"
POL,POL (prev. MATIC),45,2120689705.1479557,USD,0.15694160845193003,Scaling
ALGO,Algorand,46,2106013962.023886,USD,0.2943137956694931,"Smart contract platforms, Layer 1, Made in America, Real-world assets"
GT,GateToken,47,2064037504.284,USD,0.1347972633709358,"Centralized exchange, Exchange tokens"
ARB,Arbitrum,48,2014516231.2745,USD,0.43644959200331646,"Scaling, Web3, DAO"
VET,VeChain,49,1976452156.4945219,USD,0.5135685612098022,"Smart contract platforms, Internet of things, Logistics, Layer 1, Real-world assets"
RENDER,Render,50,1847388126.070176,USD,0.4521566274677426,"Gaming, Distributed computing and storage, Data management and AI, NFTs and collectibles, Scaling, Social media and content, Metaverse, Web3, DePIN, Made in America"
WLD,Worldcoin,51,1794878324.8634107,USD,0.17612479110930293,"Privacy, Identity, Made in America"
TRUMP,OFFICIAL TRUMP,52,1776093769.6073718,USD,,"Memes, Made in America"
IP,Story,53,1767108292.624,USD,,"Smart contract platforms, Data management and AI, Layer 1, Made in America"
SKY,Sky,54,1674795917.7851434,USD,,"Cryptocurrencies, Lending and borrowing, DeFi, DAO, Real-world assets"
ATOM,Cosmos,55,1667686220.8436,USD,0.22157219700227365,"Smart contract platforms, Interoperability, Layer 1"
SEI,Sei,56,1642437504.0088499,USD,0.6407697992331877,"Developments tools, Layer 1, Made in America, World Liberty Financial portfolio"
FLR,FLARE,57,1649839707.7972193,USD,0.020599390773017888,"Developments tools, Interoperability, Layer 1"
FIL,Filecoin,58,1615643611.704,USD,0.14277952729548024,"Distributed computing and storage, Data management and AI, Web3, Layer 1, DePIN, Made in America"
SPX,SPX6900,59,1526735568.405793,USD,0.4090266530367364,Memes
XDC,XDC Network,60,1532733795.6911108,USD,0.19878412095962264,"Smart contract platforms, Enterprise solutions, Layer 1, Real-world assets"
FET,Artificial Superintelligence Alliance,61,1532440756.0328748,USD,0.6112869211893058,"Data management and AI, Interoperability, Layer 1"
FORM,Four,62,1457816433.2399256,USD,0.06051071039574004,Gaming
FDUSD,First Digital USD,63,1449793414.8486168,USD,0.05536086270248558,"Stablecoins, Fiat-backed stablecoins"
JUP,Jupiter,64,1420812108.989676,USD,0.21925476554030915,"Decentralized exchange, Derivatives, Interoperability, DeFi, Exchange tokens"
KCS,KuCoin Token,65,1336783506.819835,USD,0.07711896920648571,"Centralized exchange, Exchange tokens"
QNT,Quant,66,1329208453.8,USD,0.274358135858132,"Interoperability, Real-world assets"
INJ,Injective,67,1316517248.41429,USD,0.918475336091935,"Smart contract platforms, Data management and AI, Interoperability, DeFi, Web3, Layer 1, Made in America, Real-world assets"
CRV,Curve DAO Token,68,1225289293.2366788,USD,0.29418504947716173,"Decentralized exchange, DeFi, DAO, Exchange tokens"
STX,Stacks,69,1229201647.188233,USD,0.2871040088989368,"Smart contract platforms, Gaming, NFTs and collectibles, DeFi, Metaverse, Web3, Made in America"
TIA,Celestia,70,1203702190.6175404,USD,0.8637582043511063,"Developments tools, Scaling, Layer 1"
OP,Optimism,71,1171617238.39254,USD,0.43104225192539936,"Scaling, Made in America"
CFX,Conflux,72,1071459604.6781851,USD,0.3335813843305584,"Smart contract platforms, Interoperability, DeFi, Web3"
FLOKI,FLOKI,73,1041057698.2956029,USD,0.43722206915730466,"Memes, Gaming, Metaverse"
PUMP,Pump.fun,74,1069257000.0000001,USD,,
PYUSD,PayPal USD,75,1008341700.0863672,USD,0.017766974541727928,"Stablecoins, Asset-backed stablecoins, Fiat-backed stablecoins"
FARTCOIN,Fartcoin,76,973858301.5881599,USD,0.9343111177486926,"Memes, Data management and AI"
GRT,The Graph,77,960074090.5724229,USD,0.17509482157065206,"Data management and AI, Enterprise solutions, Web3, Made in America"
PAXG,PAX Gold,78,954089616.57418,USD,0.10698808582736165,"Asset-backed tokens, Real-world assets"
ENS,Ethereum Name Service,79,950847525.4561176,USD,0.11213793352061613,"Identity, Web3, DAO"
IMX,Immutable,80,947739817.6094588,USD,0.21989849650196594,"Privacy, Developments tools, Gaming, NFTs and collectibles, Scaling, Marketplace"
WIF,dogwifhat,81,909983310.955469,USD,0.06578930428132589,Memes
CAKE,PancakeSwap,82,889668911.7880694,USD,0.20753886203815522,"Privacy, Decentralized exchange, DeFi, Exchange tokens"
KAIA,Kaia,83,871483428.4908684,USD,0.07351407582120759,"Enterprise solutions, Layer 1"
M,MemeCore,84,876356181.3593999,USD,,Memes
NEXO,Nexo,85,852589435.3187964,USD,0.09462845136355093,"Lending and borrowing, Payments"
S,Sonic,86,855590400,USD,0.6340749972319568,Layer 1
XAUT,Tether Gold,87,828784105.12,USD,0.04171376631536122,"Asset-backed tokens, Real-world assets"
LDO,Lido DAO,88,832618483.2826015,USD,0.13621347148658078,"Derivatives, DeFi, DAO"
XTZ,Tezos,89,799131783.881162,USD,0.5061012820545832,"Smart contract platforms, Layer 1, Made in America"
VIRTUAL,Virtuals Protocol,90,794512395.2885017,USD,0.11110796398196524,"Gaming, Data management and AI, Metaverse"
A,Vaulta,91,789940369.2785658,USD,,"Cryptocurrencies, Smart contract platforms, Enterprise solutions, DeFi, Made in America"
THETA,Theta Network,92,754200000,USD,0.08600245647734968,"Smart contract platforms, Distributed computing and storage, Data management and AI, Enterprise solutions, Social media and content, Web3, Layer 1, DePIN, Made in America"
JASMY,JasmyCoin,93,744691140.137851,USD,0.17638228349396567,Internet of things
IOTA,IOTA,94,733063323.77237,USD,0.18075965403323196,"Cryptocurrencies, Internet of things, Social media and content, Layer 1, DePIN, Real-world assets"
GALA,Gala,95,697544903.8328516,USD,0.26006730850935084,"Gaming, NFTs and collectibles, Layer 1, Made in America"
RAY,Raydium,96,696139298.2608653,USD,0.3484,"Decentralized exchange, DeFi, Exchange tokens"
SAND,The Sandbox,97,685112514.0050573,USD,0.14368075064179975,"Gaming, NFTs and collectibles, Metaverse, Marketplace"
AERO,Aerodrome Finance,98,679927368.3582908,USD,0.13647096387124352,"Decentralized exchange, DeFi, Made in America"
PENDLE,Pendle,99,667591896.8942921,USD,0.10698808582736165,"Social media and content, DeFi, Web3, Real-world assets"
PYTH,Pyth Network,100,661133296.6830171,USD,0.15295047648965782,"Oracles, Interoperability"
BTT,BitTorrent-New,101,643355592.6570497,USD,0.06733425858930223,"Distributed computing and storage, Web3, DePIN"
DEXE,DeXe,102,621201538.8919346,USD,0.04493242112364527,"Data management and AI, Asset management, DeFi"
JTO,Jito,103,617308962.00666,USD,0.15977402468322,"Derivatives, DeFi, DAO"
RLUSD,Ripple USD,104,602683249.4876161,USD,,"Stablecoins, Fiat-backed stablecoins"
ZEC,Zcash,105,585840593.9863876,USD,0.11612906548288836,"Privacy, Cryptocurrencies, Layer 1, Made in America"
AB,AB,106,578139893.8352785,USD,0.012488380656142096,"Enterprise solutions, Marketplace"
FLOW,Flow,107,573212874.6004431,USD,0.062441903280710476,"Smart contract platforms, NFTs and collectibles, Sports, Layer 1"
MORPHO,Morpho,108,570863003.6558014,USD,0.03128532473652092,"Lending and borrowing, DeFi"
USDD,USDD,109,560647020.0432199,USD,0.025877984658603723,"Stablecoins, Algorithmic stablecoins"
MANA,Decentraland,110,551366544.5824225,USD,0.14870185214272288,"Gaming, NFTs and collectibles, Metaverse"
WAL,Walrus,111,537456812.62674,USD,,"Distributed computing and storage, DePIN"
SYRUP,Maple Finance,112,523814638.23423874,USD,0.3836636531474582,"DeFi, DAO, Real-world assets"
HNT,Helium,113,517184113.17844516,USD,0.1445819739881193,"Internet of things, Enterprise solutions, Web3, DePIN, Made in America"
BRETT,Brett (Based),114,516630533.50774497,USD,0.36216303902812075,Memes
BSV,Bitcoin SV,115,512165906.71875,USD,0.0981045985564977,"Cryptocurrencies, Scaling"
B,BUILDon,116,499560000,USD,,"Memes, World Liberty Financial portfolio"
XCN,Onyxcoin,117,496768882.4125,USD,0.12591377610007184,"Enterprise solutions, Layer 1, Made in America"
TUSD,TrueUSD,118,492937579.88523,USD,0.0599957256264146,"Stablecoins, Asset-backed stablecoins, Fiat-backed stablecoins"
CORE,Core,119,483578141.69217074,USD,0.020599390773017888,"Scaling, Web3, DAO, Layer 1"
DEEP,DeepBook Protocol,120,477353099.99999994,USD,0.10222447671110128,"Decentralized exchange, DeFi, Exchange tokens"
NFT,APENFT,121,472685273.09999996,USD,0.020599390773017888,"NFTs and collectibles, Marketplace"
MOG,MOG Coin,122,469657450.53594303,USD,0.3387312320238129,Memes
ZBCN,Zebec Network,123,460167041.87513334,USD,0.3329376533689016,"Payments, DeFi, DePIN, Made in America, Real-world assets"
RUNE,THORChain,124,457810476.9924,USD,0.20135904480624986,"Decentralized exchange, DeFi, Layer 1, Exchange tokens"
STRK,Starknet,125,446703843.6964411,USD,0.31826058744312635,"Privacy, Scaling, Web3"
RSR,Reserve Rights,126,443780635.0928832,USD,0.09012233463195325,"Cryptocurrencies, Made in America, Real-world assets"
SUPER,SuperVerse,127,429458624.163026,USD,0.2913526332458718,"Gaming, NFTs and collectibles, Made in America"
COMP,Compound,128,427326068.57730544,USD,0.06282814185770456,"Lending and borrowing, DeFi, DAO, Made in America"
CVX,Convex Finance,129,426296683.6238978,USD,0.28684651651427406,DeFi
KAVA,Kava,130,421663012.716,USD,0.043129974431006204,"Smart contract platforms, Web3, Layer 1, Made in America"
ETHFI,ether.fi,131,420448966.833,USD,0.06141193374205958,DeFi
APE,ApeCoin,132,421861174.15749997,USD,0.4333596833873638,"Memes, NFTs and collectibles"
AR,Arweave,133,421705484.8578,USD,0.1637651566454922,"Distributed computing and storage, Web3, Layer 1, DePIN"
DYDX,dYdX,134,415267850.6688559,USD,,"Decentralized exchange, Layer 1, Made in America, Exchange tokens"
NEO,Neo,135,414465009.3067,USD,0.12205139033013099,"Smart contract platforms, Enterprise solutions"
SUN,Sun (New),136,411805904.34365404,USD,0.0024461776542958743,"Payments, DeFi"
EGLD,MultiversX,137,410132602.03603214,USD,0.1347972633709358,"Smart contract platforms, Gaming, Distributed computing and storage, Identity, Scaling, Enterprise solutions, Payments, Loyalty and rewards, DeFi, Metaverse, Web3, Layer 1, DePIN"
XEC,eCash,138,404495922.93897915,USD,0.07621774586016618,"Cryptocurrencies, Layer 1"
AIOZ,AIOZ Network,139,403381956.3365417,USD,0.03733639577609492,"Distributed computing and storage, Data management and AI, Web3, Layer 1, DePIN"
AXS,Axie Infinity,140,377863375.93492717,USD,0.23238687715810805,"Gaming, NFTs and collectibles, Metaverse"
CHZ,Chiliz,141,377202714.27236694,USD,0.11136545636662797,"Loyalty and rewards, Sports, Layer 1"
ZK,zkSync,142,375489057.39006644,USD,0.2710107348575166,Privacy
WEMIX,WEMIX,143,358157919.17163014,USD,0.05960948704942052,"Gaming, Scaling, Marketplace, Layer 1"
1INCH,1inch Network,144,358243289.36463326,USD,0.014677065925775246,"Decentralized exchange, Payments, DeFi, Exchange tokens"
W,Wormhole,145,357738832.857338,USD,0.22182968938693637,"NFTs and collectibles, Interoperability, DeFi, Web3, DAO"
EIGEN,EigenLayer,146,356752392.53898776,USD,0.08767615697765739,Made in America
RON,Ronin,147,350781667.6024701,USD,0.11291041067460429,"Smart contract platforms, Gaming, NFTs and collectibles, Layer 1"
AXL,Axelar,148,344248610.8275063,USD,0.0114584111174912,"Interoperability, Made in America, Real-world assets"
MOVE,Movement,149,341691000,USD,,"Made in America, World Liberty Financial portfolio"
BEAM,Beam,150,334518799.7865168,USD,0.22273091273325593,Gaming
ATH,Aethir,151,332862946.06029904,USD,0.06578930428132589,"Distributed computing and storage, Data management and AI, DePIN"
LUNC,Terra Classic,152,331079031.4178018,USD,0.1944067504203563,"Smart contract platforms, Payments, Layer 1"
JST,JUST,153,324551700,USD,0.01647951261841431,DeFi
GNO,Gnosis,154,317474362.0007242,USD,0.03218654808284045,"Prediction markets, DeFi, Layer 1, Exchange tokens"
TWT,Trust Wallet Token,155,311912448.13799995,USD,0.05304343124052106,Payments
CTC,Creditcoin,156,306315653.33774996,USD,0.03141407092885228,"Lending and borrowing, Layer 1, Real-world assets"
AMP,Amp,157,301787976.128848,USD,0.14200705014149206,"Payments, DeFi, Made in America"
FTT,FTX Token,158,297942785.59334606,USD,0.21449115642404876,"Centralized exchange, Derivatives, Exchange tokens"
TURBO,Turbo,159,296417100,USD,0.2569773998933982,"Memes, Data management and AI, NFTs and collectibles, Web3"
POPCAT,Popcat (SOL),160,296882876.27457,USD,0.5257994494812815,Memes
DOG,Dog (Bitcoin),161,296520000,USD,0.7570276109084074,Memes
AKT,Akash Network,162,289724693.79008543,USD,0.2056076691531848,"Distributed computing and storage, Data management and AI, Web3, DePIN, Made in America"
DCR,Decred,163,279380712.32759446,USD,0.03527645669879313,"Cryptocurrencies, DAO, Layer 1"
KAITO,KAITO,164,275835083.4603,USD,,"Data management and AI, Social media and content"
IOTX,IoTeX,165,270466897.141413,USD,0.07840643112979934,"Smart contract platforms, Distributed computing and storage, Internet of things, DePIN, Made in America"
MEW,cat in a dogs world,166,268017777.7750976,USD,0.06862172051261584,Memes
LPT,Livepeer,167,266110445.0181043,USD,0.06347187281936137,"Distributed computing and storage, Data management and AI, Social media and content, Web3, DePIN"
VELO,Velo,168,264230952.27406,USD,0.15887280133690046,"NFTs and collectibles, Lending and borrowing"
OM,MANTRA,169,262795763.32445127,USD,0.12630001467706592,"Lending and borrowing, DeFi, DAO, Layer 1, Real-world assets"
MOCA,Moca Network,170,260984471.5834315,USD,0.046863614008615696,"Identity, NFTs and collectibles, Metaverse"
SAFE,Safe,171,260235770.47278,USD,0.03295902523682862,Payments
FXS,Frax (prev. FXS),172,258156871.7249312,USD,0.08587371028501832,"Algorithmic stablecoins, Seigniorage, Decentralized exchange, DeFi, Made in America"
DASH,Dash,173,257322967.15183073,USD,0.11677279644454516,"Privacy, Cryptocurrencies, DAO, Made in America"
CKB,Nervos Network,174,256540967.3767266,USD,0.3279165518679785,"Smart contract platforms, Scaling"
TFUEL,Theta Fuel,175,254724472.64499998,USD,0.040426304392047606,"Smart contract platforms, Distributed computing and storage, Social media and content, Metaverse, DePIN, Made in America"
TOSHI,Toshi,176,244896199.237152,USD,0.3416923944474342,Memes
USELESS,Useless Coin,177,241962548.2233348,USD,,Memes
KSM,Kusama,178,235611202.05310202,USD,0.023946791773633295,"Smart contract platforms, Made in America"
GLM,Golem,179,234310000,USD,0.04210000489235531,"Distributed computing and storage, Data management and AI, Payments, Web3, DePIN"
SFP,SafePal,180,229580000,USD,0.04107003535370442,Payments
PNUT,Peanut the Squirrel,181,227006415.31209236,USD,0.31323948594220324,Memes
MINA,Mina,182,226379773.61099392,USD,0.08793364936232011,"Privacy, Smart contract platforms, Layer 1"
BERA,Berachain,183,223547703.02640018,USD,,"DeFi, Layer 1"
ZRO,LayerZero,184,224293171.73018482,USD,0.1958229585360013,Interoperability
TRAC,OriginTrail,185,220074118.64452028,USD,0.08432875597704198,"Privacy, Distributed computing and storage, Data management and AI, Interoperability, Enterprise solutions, Marketplace, Web3, DePIN, Real-world assets"
BAT,Basic Attention Token,186,220177338.8269931,USD,0.06733425858930223,"Smart contract platforms, Data management and AI, Interoperability, Social media and content, Marketing, Web3, Made in America"
QTUM,Qtum,187,217925656.33260003,USD,0.043129974431006204,Smart contract platforms
EURC,EURC,188,215189299.62030324,USD,0.018024466926390655,"Stablecoins, Fiat-backed stablecoins"
BABYDOGE,Baby Doge Coin,189,214703196.4018095,USD,0.022273091273325593,"Memes, Decentralized exchange, Gaming, Data management and AI, NFTs and collectibles, Interoperability, Payments, Social media and content, Marketing, Loyalty and rewards, DeFi, Real estate, Marketplace, Web3, Made in America, Tap to earn, Real-world assets, Exchange tokens"
NOT,Notcoin,190,213235459.94016317,USD,0.005536086270248557,"Memes, Gaming, Social media and content, Web3, Tap to earn"
SUSHI,SushiSwap,191,212165041.2287448,USD,0.1385309029485453,"Decentralized exchange, Gaming, DeFi, DAO, Exchange tokens"
MX,MX TOKEN,192,211226212.2398,USD,0.02085688315768061,"Centralized exchange, Exchange tokens"
ZIL,Zilliqa,193,211458357.08530197,USD,0.1344110247939417,"Smart contract platforms, Gaming, Layer 1"
RVN,Ravencoin,194,208234421.88691172,USD,0.05149847693254472,"Cryptocurrencies, DeFi, Made in America, Real-world assets"
CHEEMS,Cheems,195,209206959.8023891,USD,,Memes
BLUR,Blur,196,203116752.1117968,USD,0.1924755575353859,"NFTs and collectibles, Made in America"
SNX,Synthetix,197,202700022.62377495,USD,0.05523211651015421,"Decentralized exchange, Derivatives, DeFi, DAO, Real-world assets, Exchange tokens"
ZRX,0x Protocol,198,201960801.7977127,USD,0.04016881200738488,"Decentralized exchange, DeFi, DAO, Made in America, Exchange tokens"
GAS,Gas,199,193813630.2751,USD,0.2578786232397177,"Cryptocurrencies, Payments"
ACH,Alchemy Pay,200,193576326.52539548,USD,0.12269512129178779,Payments
SMART,SMART,202,38647843800.84,USD,,Smart contract platforms
STETH,Lido Staked ETH,203,31660272441.04358,USD,0.07029542101292353,"Derivatives, DeFi, Rehypothecated assets, World Liberty Financial portfolio"
AIX,Ai Xovia,204,15451000000,USD,,
WBTC,Wrapped Bitcoin,205,14519632801.715982,USD,0.09359848182490003,"Privacy, Wrapped tokens, Cryptocurrencies, Rehypothecated assets, World Liberty Financial portfolio"
WSTETH,Lido wstETH,206,14496805395.8543,USD,0.01647951261841431,"Derivatives, Rehypothecated assets"
WETH,WETH,207,11984773929.387276,USD,0.013132111617798904,"Privacy, Wrapped tokens, DePIN, Rehypothecated assets"
UGOLD,UGOLD Inc.,208,11365965290.75,USD,,Asset-backed tokens
WBETH,Wrapped Beacon ETH,209,11330339637.23701,USD,0.004119878154603578,"Derivatives, Rehypothecated assets"
WEETH,Wrapped eETH,210,9942585461.104279,USD,0.010943426348165754,"Privacy, Wrapped tokens, DeFi, Rehypothecated assets"
AETHWETH,Aave Ethereum WETH,211,8836575771.465687,USD,,"Asset management, Rehypothecated assets"
EDLC,Edelcoin,212,7798733944.32,USD,,"Stablecoins, Asset-backed stablecoins"
USDS,USDS,213,7727288497.582257,USD,,"Stablecoins, Asset-backed stablecoins, Rehypothecated assets"
CBBTC,Coinbase Wrapped BTC,214,5675253230.86273,USD,0.03772263435308901,"Wrapped tokens, Rehypothecated assets"
SUSDE,Ethena Staked USDe,215,5234081396.161941,USD,0.012617126848473456,"Stablecoins, Asset-backed stablecoins, Rehypothecated assets"
ZETRIX,Zetrix,216,4950552375.49915,USD,0.0001287461923313618,"Interoperability, Web3, Layer 1"
L1X,Layer One X,217,4395160315.835,USD,,"Interoperability, Scaling, Web3, Layer 1"
WBT,WhiteBIT Coin,218,3682646606.994,USD,,"Centralized exchange, Derivatives"
JITOSOL,Jito Staked SOL,219,2580132038.893058,USD,0.016994497387739758,"Derivatives, Rehypothecated assets"
HTX,HTX,220,2150978490,USD,0.009784710617183497,"Centralized exchange, Exchange tokens"
FTN,Fasttoken,221,1997815972.6321998,USD,0.01223088827147937,Layer 1
ZIK,Zik coin,222,1779900000,USD,,
BNSOL,Binance Staked SOL,223,1724095108.1206446,USD,,Rehypothecated assets
RETH,Rocket Pool ETH,224,1695353640.2562242,USD,0.005922324847242643,"Derivatives, Rehypothecated assets"
JLP,Jupiter Perps LP,225,1670646541.9811985,USD,0.012102142079148009,"Decentralized exchange, DeFi"
MKR,Maker,226,1600417290.6342,USD,0.2237608822719068,"Lending and borrowing, DeFi, DAO, Made in America, Real-world assets"
RSETH,Kelp DAO Restaked ETH,227,1575836135.9880958,USD,0.0016737005003077032,"Derivatives, Rehypothecated assets"
LBTC,Lombard Staked BTC,228,1466091439.991096,USD,,Rehypothecated assets
RYO,RYO Coin,229,1488164602.1632001,USD,0.003089908615952683,"Payments, Layer 1"
USDTB,Ethena Labs (USDTb),230,1436629225.8438478,USD,,"Stablecoins, Asset-backed stablecoins, Fiat-backed stablecoins, Rehypothecated assets"
SDAI,Savings Dai,231,1318903502.9290001,USD,0.0021886852696331506,"Stablecoins, Asset-backed stablecoins"
LSETH,Liquid Staked ETH,232,1313591660.2552211,USD,0.0028324162312899598,"Derivatives, Rehypothecated assets"
METH,Mantle Staked Ether,233,1289062949.9463382,USD,0.009012233463195327,"Derivatives, Rehypothecated assets"
BIT,BitDAO,234,1323939311.515158,USD,0.005922324847242643,DAO
EZETH,Renzo Restaked ETH,235,1169412934.07499,USD,0.0027036700389585977,"Derivatives, Rehypothecated assets"
HUGE,HugeWin,236,1127924280,USD,0.01995565981136108,Gambling
USDF,Falcon USD,237,1075630918.1863892,USD,,Stablecoins
MSOL,Marinade Staked SOL,238,843041973.48,USD,0.045447405892970714,"Derivatives, DeFi, Rehypothecated assets"
EOS,EOS,239,790778567.62275,USD,0.13775842579455713,"Smart contract platforms, Made in America, World Liberty Financial portfolio"
CMETH,Mantle Restaked Ether,240,743384184.60436,USD,,"Derivatives, Rehypothecated assets"
TBTC,tBTC,241,697485514.5199127,USD,,Rehypothecated assets
USDY,Ondo US Dollar Yield,242,689858141.5476761,USD,0.0072097867705562604,Stablecoins
USD0,Usual USD,243,645031735.5502913,USD,0.001931192884970427,"Stablecoins, Asset-backed stablecoins, Real-world assets"
